205870,Ojo de Bife 1 Kg
205894,Milanesa de Peceto Novillito 1 Kg
205955,Chiquizuela Novillito 1 Kg
205979,Espinazo de Novillito 1 Kg
206020,Carnanza Comun de Novillo 1 Kg
206044,Falda Deshuesada Novillito Bandeja 1 Kg
206051,Carne Picada Comun 1 Kg
206105,Entraña de Novillito 1 Kg
206136,Bife Ancho de Novillito 1 Kg
206143,Rost Beef en Trozo de Novillito 1 Kg
206181,Palomita de Novillito 1 Kg
206198,Tortuguita Novillito 1 Kg
206235,Paleta en Trozo Novillito 1 Kg
206280,Milanesa Cuadrada de Novillito 1 Kg
206297,Milanesa de Nalga Novillito 1 Kg
206303,Milanesa Bola de Lomo 1 Kg
206310,Bife Angosto de Novillito 1 Kg
206334,Colita de Cuadril de Novillito 1 Kg
206358,Cuadril de Novillito 1 Kg
206693,Bife de Chorizo Ternera 1 Kg
206907,Falda de Ternera 1 Kg
216616,Azotillo de Ternera 1 Kg
221184,Salchichon Feteado Paladini 1 Kg
230407,Queso Senda en Sobre La Paulina 1 Kg
231688,Dulce de Zapallo Dulcor 1 Kg
274357,Queso Rallado Vea 1 Kg
279680,Bola de Lomo de Novillito en Bandeja 1 Kg
279703,Osobuco de Novillito 1 Kg
279710,Falda de Novillito 1 Kg
279734,Milanesa Cuadrada de Novillito en Bandeja 1 Kg
280037,Paleta de Novillito 1 Kg
280204,Colita de Cuadril Bandeja 1 Kg
280259,Costilla en Bandeja 1 Kg
286848,Milanesa de Nalga de Novillo en Bandeja 1 Kg
288132,Aguja con Hueso Bandeja 1 Kg
288989,Chorizo de Cerdo Carnevalli 1 Kg
289153,Morcilla con Cebolla Carnevalli 1 Kg
289177,Salchichas Fresca Carnevalli 1 Kg
630344,Pan Dulce con Frutas Cristal 400 Gr
896887,Chorizo Fresco Chacarero Frideza 1 Kg
1034448,Trapo de Piso Mil Usos 1 Un
1307504,Ketchup Rocket Up Side Down Pet Heinz 397 Gr
1312409,Ketchup Rocket Up Side Down Heinz 397 Gr
2077055,Queso Tybo Ramolac 1 Kg
2079714,Salame Tipo Milan Cagnoli 1 Kg
2130828,Pan Baguette 200 Gr
2130835,Pan Baguette con Salvado 200 Gr
2352312,Vacio Congelado 1 Kg
4016007,Confites Originales Skittles 61 Gr
4016205,Caramelos Masticables Wildberry Skittles 61 Gr
7933622,Confites Grape Strawberry Nerds 46.4 Gr
7935725,Confites Apple Lemonade Nerds 46.7 Gr
19005102,Chicle Frutilla y Fresa Arcor Poosh 1 Un
20336820,Condimento Balsamico Mazzetti 250 Ml
23529953,Dulce de Leche Castelmar 1 Kg
26031101,Bolsas Verdes 45x60 Cm Esteban 1 Un
27189368,Aceto Balsamico en Botella Mazzetti 250 Ml
30108417,Mascara para Pestañas Maybelline Volum Express 10 Gr
30108493,Mascara Pestañas Maybelline Volume 1 Un
30114326,Mascara para Pestañas Max Lash Negro Emolan 1 Un
40084107,Huevo de Chocolate Sorpresa Kinder 20 Gr
40122342,Mostaza Fuerte Khune 250 Ml
40122380,Mostaza con Hierbas Frasco Kuhne 250 Gr
40122526,Mostaza en Granos Frasco Kuhne 250 Gr
40786186,Cerveza Rubia Lowenbrau 330 Ml
40804927,Salsa Gourmet Steak Khune 250 Ml
40804934,Salsa Gourmet Mexico Pet Kuhne 250 Cc
40804996,Salsa Gourmet Gitana Khune 250 Ml
41007723,Cerveza Rubia en Lata Konig Pilsener 500 Ml
41024355,Cerveza Rubia en Lata Draft Bitburger 500 Ml
42096276,Desodorante Antitranspirante Mujer en Barra Nivea Comfort 43 Ml
42126560,Desodorante Atitranspirante Nivea Pearl & Beauty 43 Ml
42149996,Cerveza Rubia Porron Becks 330 Ml
42171850,Gel de Limpieza Exfoliante Nivea 75 Ml
42172536,Gel Limpieza Equilibrante Nivea Visage 150 Ml
42207573,Crema Nivea Soft 50 Ml
42211051,Tonico Nivea Desmaquillante de Ojos Bifasico 125 Cc
42231301,Desodorante Antitranspirante en Barra Nivea Sensitive Protect 43 Gr
42231486,Gel Exfoliante en Pomo Nivea Visage 75 Ml
42231509,Gel Limpiador Equilibrante en Pomo Nivea Visage 150 Gr
42269847,Desmaquillador de Ojos en Frasco Nivea Visage 125 Ml
42277132,Desmaquillador de Ojos Bifasico en Botella Nivea 125 Ml
42277705,Crema Facial Cuidado Radiante Nivea 50 Ml
42277712,Crema Facial Cuidado Radiante Nivea 100 Ml
42277842,Desodorante Antitranspirante en Barra Nivea Protect and Care 43 Gr
42300076,Crema Facial Cuidado Nivea 50 Ml
42300083,Crema Facial Cuidado Nivea 100 Ml
42333401,Crema Facial Cuidado Sensitive Nivea 50 Ml
42333418,Crema Facial Cuidado Sensitive Nivea 100 Ml
42345466,Crema de Manos Vainilla Nivea 75 Ml
42389422,Crema Cuidado Facial Nivea 200 Ml
57892054,Pate de Foie La Blanca 90 Gr
75001629,Cerveza Rubia Sol Lager 330 Cc
75002817,Cerveza Negra Negra Modelo 330 Cc
75024956,Desodorante Antitranspirante en Barra Men V8 Rexona 50 Gr
75026455,Desodorante Stick Nutritivo Rexona 50 Gr
75027513,Desodorante Original Dove 50 Gr
75027537,Desodorante Invisible Dry Dove 50 Gr
75030889,Cerveza Rubia Porron Corona 210 Ml
75031060,Desodorante en Barra Dove Clean Comfort 50 Gr
75031589,Cerveza Long Neck Negra Modelo 355 Cc
75032715,Cerveza Rubia Corona 335 Cc
75043308,Desodorante Apollo Stick en Barra Axe 54 Gr
75047849,Desodorante en Barra Antibacterial Mujer Rexona 50 Gr
75047856,Desodorante en Barra Antibact Hombre Rexona 50 Gr
75048099,Desdorante Stick Black en Barra Axe 54 Gr
75050849,Desodorante Roll On Powder Soft Dove 50 Ml
75051747,Desodorante Adrenaline Stick en Barra Axe 50 Gr
75058845,Desodorante Roll On Women Antibacterial Invisible Rexona 50 Ml
75058852,Desodorante Roll On Men Antibacterial Invisible Rexona 50 Ml
75062613,Espuma de Afeitar Sensitive Gillette 56 Gr
75063108,Desodorante Hipoalergenico Dove 50 Gr
75063115,Antitranspirante Roll On Renovador Dove 50 Ml
75063177,Antitraspirante Gold Antimarks Rollon Axe 50 Cc
75067038,Desodorante Stick Ap Ice Chill Axe 50 Gr
75067069,Antitranspirante Stick Sports Men Dove 50 Gr
75067373,Desodorante Clinical Classic Roll On Rexona 50 Ml
75067410,Desodorante Roll On Clinical Clean Rexona 50 Ml
75067946,Antitranspirante Roll On Original Clinical Dove 50 Cc
75068066,Desodorante en Roll On Matcha Dove 50 Ml
75068493,Desodorante Stip Ap Matcha Dove 50 Gr
75068677,Desodorante en Roll On Sport Men Rexona 50 Ml
75068684,Desodorante en Roll On Sport Men Rexona 50 Ml
75069209,Desodorante Sti Ap Sport Men Rexona 50 Gr
75069216,Desodorante Sti Ap Sport Rexona 50 Gr
76145513,Chocolate con Leche Toblerone 50 Gr
77900050,Manteca Ilolay 100 Gr
77900067,Manteca Extra Firme Ilolay 200 Gr
77900098,Repelente de Insectos Crema Off 90 Gr
77900104,Manteca Ilolay 500 Gr
77900111,Jabon Glicerina Neutro Nogaly 1 Un
77900296,Repelente de Insectos Crema Kids Off 90 Gr
77900302,Repelente Crema Off 60 Gr
77900319,Repelente Extra Duracion Active Off 90 Gr
77900470,Desodorante en Crema Noveltex 60 Gr
77900661,Sal Fina en Salero Celusal 100 Gr
77900739,Fideos Terrabusi Foratini 500 Gr
77900845,Galletitas Bañadas en Chocolate Relleno Limon Terrabusi Tita 18 Gr
77900951,Jabon Liquido Soft & White Nogaly 275 Ml
77901002,Flan Vainilla en Pote La Lacteo 1 Un
77901026,Insecticida Mata Hormigas Liquido Hortal 3 Un 750 Ml
77901095,Caramelos Strong Zero Menthoplus 27 Gr
77901378,Shampoo Crema Balance Sedal 10 Ml
77901651,Chicles Sabor Frutilla Beldent 10 Gr
77901729,Alfajor Negro Maxialfajor Jorgelin 2 Un
77902276,Bombon Frutilla Suelto Obli Bon 1 Un
77903426,Esponja con Fibra Celulosica Verde Virulana 1 Un
77903495,Alcohol en Gel Pocket Anime 25 Gr
77903501,Galletitas Obleas Rellena Opera 55 Gr
77903518,Galletitas Obleas Rellena Opera 92 Gr
77903532,Galletitas Amor Bagley 112 Gr
77903549,Galletitas Mellizas Bagley 112 Gr
77903617,Huevo de Pascuas decorado con Azucar Cannettine 50 Gr
77903778,Alfajor Triple Leche Milka 70 Gr
77903785,Alfajor Mousse Triple Milka 55 Gr
77903792,Alfajor Triple Dulce de Leche Terrabusi 70 Gr
77903860,Alfajor Triple Torta Terrabusi 70 Gr
77904331,Desodorante Antitranspirante Aero Antibacterial Rexona 56 Gr
77904607,Gelatina Shimy 110 Gr
77904744,Pastilla La Yapa 17 Gr
77905277,Caramelos Miel y Limon Halls 28 Gr
77905291,Caramelos Miel y Menthol Halls 28 Gr
77905321,Fideos al Huevo Tallarines Don Felipe 500 Gr
77905529,Jugo de Limon Minerva 250 Ml
77905734,Alfajores Frutados Jorgito 50 Gr
77905741,Alfajor con Baño de Chocolate Jorgito 55 Gr
77905758,Alfajores Blanco Jorgito 50 Gr
77905826,Turron de Mani Blando con Miel Cannettine 120 Gr
77906106,Whisky Los Criadores 195 Cc
77906373,Fideos Spaghetti Terrabusi 500 Gr
77906519,Desodorante Antitranspirante en Crema Noveltex 60 Gr
77907943,Caramelos Masticables Sabor Tuti Frutti Lenguetazo 13 Gr
77907967,Caramelos Masticables Frambuesa Stani Lenguetazo 13 Gr
77908193,Alfajor Negro Nevares 45 Gr
77908278,Licor de Menta Cusenier 200 Ml
77908308,Alfajor Tita 36 Gr
77908377,Licor de Cafe Cognac Cusenier 200 Ml
77908650,Crema Sapolan Dubarry 280 Cc
77908667,Sapolan Color Dubarry 280 Gr
77908704,Flan Dulce de Leche en Pote La Lacteo 130 Gr
77908827,Alfajor Negro Mogy 21 Gr
77908964,Galletita Amor Bagley 112 Gr
77910875,Caramelos Strong Menthoplus 30.6 Gr
77911551,Conejo de Pascua Rocklets 110 Gr
77912268,Alfajor Blanco Mogy 21 Gr
77912282,Galletitas Bañadas con Chocolate Oreo 17 Gr
77912374,Galletitas Bañadas con Chocolate Blanco Oreo 204 Gr
77912626,Chocolate con Leche Relleno con Frutilla Cadbury 27 Gr
77912718,Chocolate Mani Sapito Arcor 10 Gr
77913692,Licor de Dulce de Leche Tres Plumas 200 Cc
77914217,Tableta de Chocolate Shot 35 Gr
77914231,Emulsion Autobronceante Rayito de Sol 130 Gr
77915481,Alfajor con Chips Triple Pepitos 57 Gr
77915818,Barra de Cereales con Manzana Cereal Mix 23 Gr
77916105,Chocolate Milka Leger Leche 45 Gr
77916112,Chocolate Milka Leger Almendras 45 Gr
77916389,Chicles Fruta Top Line 6.7 Gr
77916396,Chicles Strong 6.7 Gr
77916419,Chicles Defense 6.7 Gr
77916426,Chicles Sabor Menta en Tableta 6.7 Gr
77916495,Alfajor Triple Oreo 55 Gr
77916501,Barra de Cereales Cereal Mix 23 Gr
77916525,Barra de Cereales con Chocolate Cereal Mix 23 Gr
77916969,Alfajores de Arroz Dulce de Leche Cachafaz 28 Gr
77917317,Caramelos Sabor Frutilla Halls 27 Gr
77917324,Caramelos Naranja Halls Vita C 27 Gr
77917393,Chocolate Frutilla Sapito 10 Gr
77917706,Chocolate con Mani Block Cofler 38 Gr
77917911,Chocolate sin Azucar Georgalos 30 Gr
77918543,Caramelos Sabor Menta Halls Free 20 Gr
77918765,Antitranspirante Go Fresh Dove 89 Gr
77919489,Chicles Sandia y Menta 6.7 Gr
77919496,Caramelos Sabor Tutti Frutti Lenguetazo Fiesta 13 Gr
77919540,Yogur Entero Frutilla Pote La Lacteo 160 Gr
77919564,Yogur Entero Durazno Pote La Lacteo 160 Gr
77920447,Jabon Hipoalergenico Nogaly 1 Un
77920454,Jabon Bebe Glicerina Neutro Nogaly 1 Un
77920461,Jabon Coco Nogaly 130 Gr
77920515,Pastillas Sabor Mentol y Eucaliptus Mentho Plus Arcor 30 Gr
77920539,Caramelos Duros Cereza Mentho Plus 30.6 Gr
77920577,Pastillas Sabor Miel Mentho Plus Arcor 30.6 Gr
77920676,Pastillas Sabor Menta Mentho Plus Arcor 30.6 Gr
77921000,Jabon Liquido Lirium Nogaly 275 Cc
77921031,Jabon Liquido Green Mist 275 Ml
77921048,Jabon Liquido Wild Roses Nogaly 270 Ml
77921246,Chicles sin Azucar Strong Tabletas 14 Gr
77922120,Chocolate con Mani Block Cofler 110 Gr
77922656,Caramelos Cereza Menthoplus 30.6 Gr
77922663,Caramelos Menthol Menthoplus 30.6 Gr
77922670,Caramelos Strong Menthoplus 9 Un
77922687,Caramelos Miel Menthoplus 30.6 Gr
77922694,Caramelos Sabor Menta Menthoplus 30.6 Gr
77923240,Cera Modeladora Capilatis 55 Ml
77923417,Crema Desodorante Rexona Odorono Pote 60 Cc
77923424,Desodorante Crema Odorante Rexona 60 Gr
77923462,Queso Untable con Finas Hierbas Ilolay 100 Gr
77924261,Caramelos Creamy Mora Halls 27 Gr
77924285,Caramelos Creamy Frutilla Halls 27 Gr
77924841,Desodorante Roll On Crystal Rexona 50 Ml
77925107,Huevo de Pascua Chocolate con Leche Italiana Cannettine 12 Gr
77925626,Alfajor Blanco Nevares 45 Gr
77925763,Bombon Negro Suelto Obli Bon 1 Un
77926494,Pañuelos Descartables Carrefour 1 Un
77927361,Bocadito de Dulce de Leche Light Vauquita 22 Gr
77927415,Crema para Calzado color Marron Claro en Lata Wassington 60 Gr
77928115,Alfajor Mini Torta Aguila 72 Gr
77928566,Desodorante Nutritive Roll On Rexona 50 Ml
77928672,Caramelos Sabor Berries Creamix Menthoplus 27.2
77928689,Caramelos Duros Sabor Frutilla Menthoplus 28.8 Gr
77928870,Chocolate Relleno con Dulce de Leche Sapito 10 Gr
77928894,Chocolate Sapito 10 Gr
77929235,Bocadito sin Banana con Chocolate Bananita Dolca 30 Gr
77929518,Cubanito Chocolate Oblita 5 Gr
77929525,Cubanito Marroc Oblita 5 Gr
77929624,Cubanito Relleno de Chocolate Blanco 6 Gr
77929648,Cubanito Relleno de Dulce de Leche 6 Gr
77929662,Bocadito de Marroc 10 Gr
77929686,Bocadito Dulce de Leche 10 Gr
77929693,Bocadito Dulce de Leche Blanco 10 Gr
77930002,Bombon Bon o Bon 17 Gr
77930019,Bombon Blanco Bon o Bon 1 Un
77930057,Alfajor de Mousse Cachafaz 60 Gr
77931276,Repelente Crema Extra Duracion Off 90 Gr
77931306,Turron sin Azucar Nucrem Georgalos 35 Gr
77931528,Chocolate para Taza Barrita Aguila 14 Gr
77931764,Chicles Seven X- plosive Mint 14 Gr
77932327,Chocolate en Barra Cofler Extra Coco 32 Gr
77932693,Chicles Seven Mandarina 14 Gr
77933928,Caramelos Duros Menta Lyptus Halls Free 28 Gr
77933997,Chicle Sabor Menta Beldent 10 Gr
77934000,Chicle Sabor Menta Fuerte Beldent 10 Gr
77934017,Chicles Beldent Tutti Frutti 10 Gr
77934024,Chicles Sabor Mentol Beldent 10 Gr
77934086,Chicles Beldent Mentol Turbo 10 Gr
77934499,Alfajor con Baño de Chocolate Cachafaz 60 Gr
77934505,Alfajor Blanco Cachafaz 60 Gr
77935007,Chocolate con Yogur Frutilla Cofler Light 28 Gr
77935144,Barra de Cereales con Yogur Vainilla Cereal Mix 28 Gr
77935274,Barra de Cereales con Frutilla Cereal Mix 28 Gr
77935830,Biscuits en Caja Soriano 50 Un 25 Gr
77935861,Shampoo Crema Balance Sedal 10 Ml
77936264,Barra de Cereales con Manzana Ser 23 Gr
77936271,Barra de Cereales con Frutilla Ser 23 Gr
77939234,Alfajor Clasico Terrabusi 50 Gr
77939425,Chococereal Brownie sin Azucar Georgalos 25 Gr
77939500,Huevo de Chocolate con Sorpresa Lei Kinder 20 Gr
77939753,Chicle Seven Strong 14.7 Gr
77940131,Turron Arcor 25 Gr
77940148,Turron Misky 25 Gr
77940230,Shampoo Ceramidas Sedal 10 Ml
77940247,Acondicionador Crema Balance Sedal 10 Ml
77940254,Shampoo Crema Balance Sedal 10 Ml
77940322,Gelatina Frutilla Shimy Sancor 110 Gr
77940339,Gelatina Manzana Shimy Sancor 110 Gr
77940704,Desodorante en Crema en Pote Odorono Rexona 60 Gr
77940810,Conejo de Pascuas Bon o Bon 50 Gr
77941145,Conejo Leche Bon o Bon 110 Gr
77941152,Conejo de Chocolate Blanco Bon O Bon 110 Gr
77941169,Conejo de Pascuas Rocklets 110 Gr
77941824,Desodorante en Aerosol Dove Original Comprimido 85 Ml
77941855,Desodorante en Aerosol Go Fresh Pepino Te Verde Dove 85 Ml
77941879,Desodorante Anititranspirante Roll On Sensitive Rexona 85 Ml
77941909,Desodorante Roll On Sensitive Rexona 50 Ml
77941923,Desodorante Antitranspirante Roll On Invisible Rexona 50 Gr
77941930,Desodorante Antitranspirante Roll On V8 Rexona 50 Ml
77942227,Desodorante Cotton Rexona 85 Ml
77942234,Antitraspirante Aerosol Powder Rexona Women 85 Gr
77942241,Desodorante Antitranspirante Comprimido Bamboo Woman Rexona 56 Gr
77942289,Desodorante Antitranspirante en Aerosol Rexona Active Emotion 85 Ml
77942333,Desodorante Antitranspirante Roll On Pepino y Te Verde Dove 50 Cc
77942340,Desodorante Antitranspirante Roll On Dermo Aclarant Dove 50 Ml
77942371,Chicles Sabor Menta Blister Beldent 10 Gr
77942388,Chicles Sabor Menta Blister Beldent 10 Gr
77942395,Chicles Mentol Blister Beldent 10 Gr
77942401,Chicles Mentol Turbo Blister Beldent 10 Gr
77942418,Chicles Sabor Menta Suave Beldent 10 Gr
77942630,Shampoo Ceramidas Sedal 10 Ml
77942647,Acondicionador Ceramidas Sedal 10 Ml
77942654,Shampoo Crema Balance Sedal 10 Ml
77942661,Acondicionador Crema Balance Sedal 10 Ml
77942722,Galletitas Frolitas Trio 40 Gr
77942937,Conejo de Pascuas Bon o Bon Blanco 50 Gr
77943064,Barra de Cereales con Frutilla y Chocolate Ser 28 Gr
77943446,chocolate en Rama Leche Bonafide 80 Gr
77944191,Alfajor Triple Bon o Bon 60 Gr
77944276,Chicles Globo Blister Beldent 10 Gr
77944344,Chicles Sabor Manzana Beldent 10 Gr
77944375,Alfajor Triple Negros con Dulce de Leche Tatin 60 Gr
77944382,Alfajor Triple Blancos con Dulce de Leche Tatin 60 Gr
77944405,Caramelos Menthoplus 27.2 Gr
77944412,Caramelos Acidos Naranja Menthoplus 27.2 Gr
77944511,Caramelos sin Azucar Sabor Pomelo Menthoplus 30.1 Gr
77944733,Caramelos Sabor Durazno Menthoplus 30.1 Gr
77944740,Barra Granola Cereal Mix 25 Gr
77944832,Licor de Melon Cusenier 200 Ml
77944849,Mix de Almendras y Pasas Zafran 28 Gr
77944856,Mix de Caju Arandanos y Curry Zafran 28 Gr
77944870,Mix de Frutos Secos y Salsa de Soja Zafran 28 Gr
77944900,Bombon de Chocolate con Leche Shot 12 Gr
77945075,Alfajor Mini Torta Sabor Coco Aguila 73 Gr
77945082,Alfajor Mini Torta Brownie Aguila 74 Gr
77945600,Chocolate con Extra Coco Cofler 32 Gr
77945624,Chocolate con Mani Cofler Extra 38 Gr
77945730,Barra Chocolate Cachafaz 14 Gr
77945747,Barra de Arroz Cachafaz 14 Gr
77946324,Caramelos Colors Halls 28 Gr
77946607,Conejo de Pascuas Rocklets 55 Gr
77946744,Bombones Cofler Block 18 Gr
77946805,Pastillas Crerry Menthoplus Free 26 Gr
77946812,Caramelos Duros Sabor Durazno Menthoplus 26.6 Gr
77946829,Caramelos Mentol Zero Menthoplus 26.6 Gr
77947505,Medallon de Menta Aguila 14 Gr
77947932,Shampoo Sedal Rest Inst X24Un X10Ml
77947963,Acondicionador Sedal Rest Inst X24Un X10Ml
77948496,Chicles Sabor Cereza Violet Cherry 14 Gr
77948588,Chicles Sabor Sandia 7 Un 14 Gr
77948595,Desodorante Antitranspirante Ultra Seco Plusbelle 50 Gr
77948618,Desodorante Antitranspirante Roll On Piel Sensible Plusbelle 50 Gr
77948625,Desodorante Antitranspirante Frescura Duradera Plusbelle 50 Gr
77949035,Chocolate Blanco Cofler Air 30 Gr
77949059,Chocolate Mixto Cofler Air 27 Gr
77949080,Chocolate con Leche Cofler Air 30 Gr
77949110,Desodorante Antitranspirante Aerosol Antibacterial Rexona Fresh 56 Gr
77949608,Chicles Sabor Frutilla Limon Mashup Beldent 10 Gr
77949677,Tableta de Chocolate con Leche Kinder 50 Gr
77949684,Barra de Chocolate Mixto Autos y Hadas Kinder 4 Un
77949691,Tableta de Chocolate con Leche Kinder 50 Gr
77949707,Tableta de Chocolate Relleno Kinder 100 Gr
77949714,Barra de Chocolate Mixto Autos y Hadas Kinder 8 Un
77949721,Chocolate Relleno Kinder 100 Gr
77950031,Chocolate con Mani Block Cofler 110 Gr
77950192,Bocadito Bananita Sapito 10 Gr
77951113,Chicles Seven Frutilla 14.7 Gr
77951694,Gelatina Manzana Shimy 110 Gr
77951724,Barra de Cerealcon Yogur de Frutilla Cereal Mix Pack 2 Un
77952455,Caramelos Acidos Manzana Menthoplus 27.2 Gr
77953063,Postre Dulce de Leche Danette Pack 2 Un 190 Gr
77953070,Postre Chocolate Danette Pack 2 Un 190 Gr
77953124,Chocolate con Mani Cofler Block 38 Gr
77953537,Bon O Bon Aguila 15 Gr
77954107,Deosodorante For Women Aerosol Antibacterial I Comp Rexona 53 Gr
77954725,Crema Sapolan Dubarry 200 Cc
77954930,Huevo Kinder Sorpresa Star Wars 20 Gr
77954978,Cera para Pelo y Barba Capilatis 55 Gr
77955111,Caramelos sin Azucar Sabor Cafe Latte Menthoplus 28 Gr
77955159,Barra de Almendra y Coco Zafran 28 Gr
77955166,Barra de Mani y Cacao Zafran 28 Gr
77955173,Barra de Manzana y Chia Zafran 28 Gr
77955197,Barra de Caju y Semillas de Zapallo Zafran 28 Gr
77955821,Chocolate de Taza 60 % Cacao Aguila 14 Gr
77955838,Chocolate Cofler Extra Bon O Bon 30 Gr
77956262,Sal Fina en Salero Celusal 250 Gr
77956279,Sal Fina Light en Salero Celusal 250 Gr
77956378,Huevo de Pascua Relleno de Confites Rocklets 30 Gr
77956545,Mix de Almendras y Mani Picante Zafran 28 Gr
77956699,Alfajor Triple Trishot 60 Gr
77956712,Bombon de Chocolate con Chocolinas Bon O Bon 15 Gr
77957443,Huevo con Sorpresa Toy Story 22 Gr
77958471,Repelente en Crema Fuyi 60 Gr
77958532,Caramelos Limon Vitamin Menthoplus 1 Un
77958549,Caramelos Frutilla Menthoplus Vitamin 28 Gr
77958563,Chocolatin Negro Arcor 8 Gr
77958570,Chocolatin Blanco Arcor 8 Gr
77958594,Chocolate Blanco Bon o Bon 15 Gr
77958600,Queso Crema Casancrem Light 200 Gr
77958617,Queso Crema Casancrem 200 Gr
77958624,Caramelo Mentol Menthoplus 1 Un
77958631,Caramelos Cherry Menthoplus 30.6 Gr
77958648,Caramelo Strong Menthoplus 1 Un
77958655,Caramelos Miel Menthoplus 1 Un
77958662,Caramelo Menta Menthoplus 1 Un
77958921,Bombon Chocolate con Leche Relleno Bon O Bon 16 Gr
77958945,Pomada para Zapatos Negro en Lata Wassington 60 Gr
77958952,Pomada para Zapatos Marron en Lata Wassington 60 Gr
77958969,Pomada para Zapatos Inocolora en Lata Wassington 60 Cc
77959041,Bombon de Leche Hamlet 1 Un
77959508,Chicles sin Azucar Menta Tabletas 6 Gr
77959539,Chicles sin Azucar Fruta Tabletas 6 Gr
77960641,Alfajor Leche Bon o Bon 40 Gr
77960825,Alfajor Blanco Bon o Bon 40 Gr
77961303,Sapito Carita 13 Gr
77961419,Chocolate de Leche Tortuguita Arcor 20 Gr
77961471,Chocolate Rockleton 14 Gr
77961631,Antitraspirante Femenino Roll On Care Plusbelle 50 Ml
77961648,Antitraspirante Femenino Roll On Fresh Plusbelle 50 Ml
77961655,Antitraspirante Femenino Roll On Dry Plusbelle 50 Ml
77961709,Galletitas de Avena
77961716,Galletitas de Avena
77961730,Galletitas de Cacao
77961815,Bombones de Chocolate Blanco Bon O Bon 15 Gr
77962188,Turron con Yogur Frutilla Arcor 25 Gr
77962560,Bombones Mousse de Limon Bon O Bon 16 Gr
77962706,Flan Vainilla Sancorito 110 Gr
77962898,Biscuits con Baño de Chocolate Soriano 180 Gr
77962959,Flan con Caramelo Vainilla Sancorito 110 Gr
77964137,Chicle Seven Menthol Topline 14 Gr
77964564,Caramelos 2 Mentol Menthoplus 28 Gr
77965233,Semillas de Girasol Pipas 18 Gr
77965295,Turron Fuente Fibras Arcor 25 Gr
77965349,Chocolate Huevo con Sorpresa Kinder 48 Un
77965363,Pastillas de Menta Fuerte Intersec Mint Tic Tac 16 Gr
77965370,Barra de Cereal con Yogurt Frutilla Cereal Mix Light 26 Gr
77965387,Cereal en Barra con Yoghurt Frutilla Cereal Mix 26 Gr
77965394,Barrita de Careal Yogurt Vainilla Mix Arcor 28 Gr
77965424,Barra de Cereal Proteica Yogur Frutilla Cereal Mix 26 Gr
77965431,Barra de Cereal Frutos Secos Cereal Mix 21 Gr
77965691,Caramelo sin Azucar Sandia Menthoplus 26.6 Gr
77965929,Flan Vainilla Danet 95 Gr
77967633,Postre de Chocolate Danet 95 Gr
77967640,Postre de Dulce de Leche Danet 95 Gr
77967657,Postre de Crema Americana Danet 95 Gr
77968852,Gelatina Frutilla Serenito 105 Gr
77968869,Gelatina Frambuesa Serenito 105 Gr
77969903,Galletitas Dulces con Chips Turimar 36 Un 5.4 Kg
77970701,Tableta de Chocolate sin Azucar sin TACC Mapsa 100 Gr
77971340,Tableta de Chocolate con Mani Biznikke 30 Gr
77972279,Chocolate Relleno de Leche Tofi 15 Gr
77972736,Caramelos Power Citrus Menthoplus 30 Gr
77974631,Tableta de Chocolate con Dulce de Leche Tofi 28 Gr
77974648,Chocolate Blanco Tofi 27 Gr
77976109,Tableta de Dulce de Leche Vauquita Tableta 25 Gr
77980212,Alfajor con Baño de Chocolate Blanco Guaymallen 38 Gr
77980229,Alfajor con Baño de Chocolate Guaymallen 38 Gr
77980267,Alfajor Triple Blanco Guaymallen 70 Gr
77980274,Alfajor Triple Negro Guaymallen 70 Gr
77984395,Barra de Cereal Cereal Mix Pasion de Chocolate 26 Gr
77988058,Levadura Golondrina 50 Gr
77990105,Licor Seco Tres Plumas 200 Cc
77990112,Cafe al Coñac Tres Plumas 200 Cc
77990327,Conitos Cachafaz 1 Un
77990785,Vino Tinto Calfulen 750 Ml
77991430,Chocolate Biznikke Nevado 28 Gr
77991775,Pasta Espinaca Terrabusi 500 Gr
77991829,Piña Colada American Club 200 Cc
77991867,Tequila Conquistador de Mexico 200 Cc
77991874,Cafe al Chocolate Tres Plumas 200 Cc
77991904,Cafe al Whisky Tres Plumas 200 Cc
77991911,Cafe al Ron Tres Plumas 200 Cc
77992246,Licor de Chocolate Tres Plumas 200 Cc
77992512,Caballa al Natural La Banda 425 Gr
77995407,Barra de Cereales Light con Yogur Frutilla y Fresa Cereal Mix 28 Gr
77995513,Chocolate con Extra Menta Cofler 30 Gr
77995681,Obleas Bañadas de Chocolate Rhodesia 22 Gr
77999870,Turron de Mani Cannettine 80 Gr
78006805,Desodorante Barra Ap Sensitive Rexona 50 Gr
78009226,Desodorante Dove Original Bar 50 Gr
78600010,Pastillas Tic Tac Menta Caja 16 Gr
78600027,Pastillas Tic Tac Naranja Caja 16 Gr
78602731,Huevo de Chocolate con Sorpresa Kinder 20 Gr
78605039,Pastillas Cereza Tic Tac 16 Gr
78605831,Pastillas Tic Tac Dupla de Frutilla Tic Tac 16 Gr
78606234,Pastillas Tic Tac Menta 16 Gr
78909434,Bombones Chocolate Avellana Ferrero Rocher 37.5 Gr
78912359,Chocolate con Leche Baton 16 Gr
78912366,Chocolate Blanco Baton 16 Gr
78914407,Desodorante Dove Roll On 50 Gr
78916401,Caramelos Masticables Fruta Mentos 29.7 Gr
78916418,Caramelos Masticables Menta Mentos 29.7 Gr
78921030,Desodorante Roll On Rexona 50 Gr
78921733,Deo Antitraspirante Dove Invisible en Roll on 50 Ml
78923355,Desodorante Roll On Women Nutritive Rexona 50 Ml
78923423,Desodorante Roll On Sensitive Men Rexona 50 Ml
78923454,Desodorante Roll On Men V8 Rexona 50 Ml
78924321,Desodorante Antitranspirante Roll On Rexona Women Crystal 50 Cc
78924352,Desodorante Roll On Cotton Rexona 50 Cc
78924468,Desodorante Antitranspirante Roll On Original Dove 50 Ml
78924512,Roll On Go Fresh Pepino Dove 50 Ml
78924529,Desodorante Roll On Invisible Dove 50 Ml
78925281,Caramelos Masticables Frutilla Mentos 29.7 Gr
78925472,Desodorante Roll On Men Invisible Rexona 50 Ml
78925519,Desodorante Antitranspirante Roll On Dove Men Extra 50 Cc
78926523,Desodorante Roll on Active Emotion Rexona 50 Ml
78927254,Desodorante Roll On Clean Dove 50 Ml
78928503,Desodorante Antitranspirante Roll On DoveDermoclarant 50 Ml
78930650,Caramelos Magic Mentos 29.7 Gr
78931053,Huevo de Pascua con Sorpresa en Caja Kinder 20 Gr
78933354,Desodorante Antitranspirante Roll On Dove Men Invisible Dry 50 Cc
78934146,Desodorante Roll On Women Antibacterial Rexona 50 Cc
78935068,Desodorante Roll On Gofresh Granada Dove 50 Ml
78937697,Desodorante Antitranspirante a Roll on Pera y Aloe Vera Dove 50 Cc
78938533,Pastillas Frutos Rojos Tic Tac 16 Gr
78938991,Antitranspirante Roll On Invisible Care Dove 50 Ml
79804974,Papel Higienico Linea Economica Gamuza 6 Un
79854542,Pan Arabe Blanco Alijor 5 Un
80042532,Extracto Doble de Tomate Mutti 130 Gr
80042556,Tomate Cubeteado Mutti 400 Gr
80042563,Salsa de Tomate Passata Mutti 700 Gr
80050094,Tableta de Chocolate Maxi Kinder 21 Gr
80050315,Tableta de Chocolate Kinder 12.5 Gr
80052487,Bombones con Coco y Almendras Raffaello 30 Gr
80052760,Tableta de Chocolate Kinder Bueno 43 Gr
80053811,Aceite de Oliva Extra Virgen Monini 250 Ml
80054627,Aceto Balsamico en Botella Monini 500 Ml
80054634,Aceto Balsamico en Botella Monini 500 Ml
80177609,Chocolate con Leche en Caja Kinder 50 Gr
80177616,Tableta de Chocolate Kinder Relleno 100 Gr
80220718,Licor de Naranja Strega 700 Cc
