80273332,Peperoncino Drogheria Alimentari 15 Gr
80273561,Pimienta Negra con Molinillo Drogheria y Alimentari 45 Gr
80273578,Pimienta Blanca con Molinillo Drogheria y Alimentari 45 Gr
80273585,Pimienta Verde con Molinillo Drogheria y Alimentari 15 Gr
80273592,Pimienta 4 Colores con Molinillo Drogheria y Alimentari 35 Gr
80273639,Sal Marina en Frasco con Molinillo Drogheria y Alimentari 90 Gr
80273677,Aji Peperoncino Drogheria 20 Gr
80330370,Pesto en Aceite de Oliva Colavita 130 Gr
80357711,Aceto Balsamico en Botella Monini 500 Ml
80479116,Alcaparras en Vinagre Colavita 150 Gr
80479130,Pesto Rojo en Aceite de Oliva Colavita 130 Gr
80508878,Aceite de Oliva Alba Monini 250 Cc
80724353,Corazon de Alcaucil en Hierbas Ponti 280 Gr
80725442,Berenjenas Grilladas Ponti 280 Gr
80761761,Chocolate Bueno White Kinder 39 Gr 1 Un
87167016,Cerveza Rubia Porron Grolsch 450 Ml
87167474,Cerveza Rubia Grolsch 330 Ml
89819845,Bolsa Ecologica Comodin 45 40 Cm 1 Un
90415418,Energizante Light Sugarfree Red Bull 250 Ml
93302043,Cerveza Negra Best Extra Stout Coopers 375 Ml
93302074,Cerveza Rubia Sparkling Ale en Porron Coopers 375 Cc
120620096,Dulce de Leche Repostero Mayol 500 Gr
190500106,Chicle Sabor Tutti Frutti Poosh 1 Un
201220092,Papel Film 1 Un
250820090,Bolsas de Consorcio 80x100 Cm El Gigante 10 Un
400841074,Huevos de Chocolate Kinder Sorpresa 1 Un
407861860,Cerveza Original Porron Lowenbrau 330 Ml
408211220,Cerveza Kapuziner Weissbier Naturtrub 500 Ml
421499964,Cerveza Becks 275 Ml
422212340,Cerveza Gold Beck's 330 Ml
750016290,Cerveza Porron Sol 330 Ml
750308890,Cerveza Porron Coronita 210 Ml
750315898,Cerveza Negra Modelo 355 Ml
750327150,Cerveza Corona 355 Cc
750508498,Antitranspirante Roll OnPowder Soft Dove 50 Ml
750588452,Desodorante Bolilla Antibacterial Invisible Rexona Women 50 Ml
750588520,Desodorante Bolilla Antibacterial Invisible Rexona Men 50 Ml
750626130,Espuma de Afeitar Piel Sensible Gillette 57 Ml
773082074,Cerveza Zillertal 330 Ml
779000508,Manteca Ilolay 100 Gr
779000676,Manteca Ilolay 200 Gr
779000980,Repelente Crema Off! Kids 90 Gr
779002960,Repelente Crema Off! Kids 90 Gr
779008450,Oblea Tita 18 Gr
779009204,Postre de Frutilla Danonino 90 Gr
779016516,Chicles Frutilla Beldent 7 Un
779023446,Caramelos Sprite Menthoplus 1 Un
779034954,Galletitas Merengadas Bagley 93 Gr
779035180,Galletitas Opera Bagley 92 Gr
779037788,Alfajor Triple Dulce de Leche Milka 70 Gr
779037856,Alfajor Triple Mousse Milka 55 Gr
779037924,Alfajor Triple Terrabusi 70 Gr
779038600,Alfajor Triple Torta Terrabusi 70 Gr
779043314,Desodorante Aerosol Antitranspirante Antibacteriano Rexona Women 85 Ml
779052774,Caramelos de Miel Halls 25.2 Gr
779052910,Caramelos de Miel Halls 28 Gr
779053214,Tallarines al Huevo Don Felipe 500 Gr
779061066,Whisky Añejo Criadores 195 Ml
779079436,Masticable Lenguetazo Fiesta 13 Gr
779081620,Tallarines con Calabaza Don Felipe 500 Gr
779081798,Tallarines con Albahaca Don Felipe 500 Gr
779083846,Anticeptico Liquido Espadol 125 Ml
779090158,Barra de Cereal Nutri Cereal Fort 21 Gr
779090608,Barra de Cereal Dulce de Leche Cereal Fort 22 Gr
779090844,Barra de Cereal Damasco y Salvado Cereal Fort 23 Gr
779091216,Barra de Cereal Naranja Y Avena Tostada Cereal Fort 23 Gr
779098000,Fideos Bavetas Terrabusi 500 Gr
779099236,Alfajor Chocolate Turimar 38 Gr
779100802,Alfajor Triple Chocolate Turimar 60 Gr
779102578,Chocolate Relleno con Dulce De Leche Vauquita 35 Gr
779104008,Alfarroz Limon Lulemuu 27 Gr
779105098,Alfarroz Marroc Lulemuu 27 Gr
779105166,Alfajor de Arroz Mousse Blanco Lulemuu 27 Gr
779110184,Alfajor Triple Blanco Turimar 60 Gr
779142178,Chocolate con Mani Shot 35 Gr
779153686,Barra de Cereal Durazno Cereal Mix Light 23 Gr
779154812,Alfajor Triple Pepitos 57 Gr
779158186,Barra de Cereal Manzana Cereal Mix 23 Gr
779163890,Chicle Fruta Top Line 4 Un
779163968,Chicle Strong Top Line 4 Un
779164194,Chicle Top Line Defense 4 Un
779164262,Chicle Menta Top Line 4 Un
779164576,Chicle Mentol Top Line 4 Un
779164958,Alfajor Trilogia Oreo 55 Gr
779165016,Barra de Cereal Original Cereal Mix 23 Gr
779165252,Barra de Cereal Chocolate y Almendra Cereal Mix 23 Gr
779173172,Caramelos de Frutilla Halls 25.2 Gr
779173240,Caramelos de Naranja Halls 25.2 Gr
779178504,Barra con Chocolate Rally Cofler 38 Gr
779185434,Caramelos Free Menta Halls 20 Gr
779193118,Barra de Arroz Semillas + Mousse Blanco Lulemuu 3 Un
779206764,Caramelos Menthoplus 23 Gr
779221200,Chocolate Cofler Block 110 Gr
779222672,Caramelos Duros Refresco 38 Gr
779226564,Caramelos Cereza Menthoplus 1 Un
779226632,Caramelos Mentol Menthoplus 1 Un
779226700,Caramelos Strong Menthoplus 1 Un
779226878,Caramelos Miel Menthoplus 1 Un
779226946,Caramelos Menta Menthoplus 1 Un
779227004,Caramelos Limon Menthoplus 1 Un
779227172,Caramelos Tropical con Vitamina C Menthoplus 1 Un
779227240,Caramelos Citrus con Vitamina C Menthoplus 1 Un
779227318,Caramelos Berry con Vitamina C Menthoplus 1 Un
779242618,Caramelos Creamy Mora Halls 28 Gr
779242854,Caramelos Creamy Frutilla Halls 28 Gr
779248412,Desodorante Bolilla Antitranspirante Crystal Rexona Women 50 Ml
779273612,Tableta de Dulce de Leche Suave Vauquita 22 Gr
779279898,Caramelos sin Azucar Lima Limon Menthoplus 1 Un
779285660,Desodorante Bolilla Antitranspirante Nutritive Rexona Women 50 Ml
779290756,Chicle Tutti Frutti Poosh 1 Un
779290824,Chicle de Menta Poosh 1 Un
779290992,Chicle Frutilla Poosh 1 Un
779297236,Chicle Uva Poosh 1 Un
779300028,Chocolate Bon O Bon 17 Gr
779300196,Chocolate Blanco Bon O Bon 17 Gr
779301490,Chicle Sprite Zero Top Line 6.7 Gr
779301704,Chicle Frutilla Fizz Poosh 1 Un
779317644,Chicle Mint Top Line Seven X-Plosive 14 Gr
779319624,Chicle Lemon Top Line Seven Dynamite 14 Gr
779321368,Barra de Mani Chocolate Bon O Bon 35 Gr
779323034,Barra de Mani Bon O Bon 35 Gr
779323102,Chocolate Extra Mani Cofler 46 Gr
779323270,Chocolate Extra Coco Cofler 40 Gr
779323348,Chocolate Extra Crocante Cofler 38 Gr
779326936,Chicle Mandarina Top Line Seven Blowing 14 Gr
779339288,Caramelos de Menta Halls 25.2 Gr
779345678,Chocolate Suave Bon O Bon 17 Gr
779350078,Chocolate Yoghurt Frutilla Light Cofler 27 Gr
779351440,Barra de Cereal Yogur Vainilla Cereal Mix 28 Gr
779352744,Barra de Cereal Yogur Frutilla Fresa Cereal Mix 28 Gr
779354656,Chicle Top Line Change 4 Un
779361340,Chicle Next Mint Top Line 4 Un
779367212,Caramelos Blue Menthoplus2 1 Un
779367458,Caramelos Red Menthoplus2 1 Un
779367526,Caramelos Black Menthoplus2 1 Un
779379888,Barra de Cereal Coco y Chocolate Cereal Mix 26 Gr
779384288,Chocolate Con Leche Ben 10 Cereal Milk 21 Gr
779392344,Alfajor de Chocolate Terrabusi 50 Gr
779396922,Caramelos Blueberry Menthoplus 1 Un
779397080,Caramelos Mandarina Menthoplus 1 Un
779397158,Caramelos Strawberry Menthoplus 1 Un
779398902,Desodorante Roll On Basic Care Plusbelle 50 Ml
779399060,Desodorante Roll On Nutritive Care Plusbelle 50 Ml
779399138,Desodorante Roll On Soft Care Plusbelle 50 Ml
779399206,Desodorante Roll On Calm Care Plusbelle 50 Ml
779401176,Chicle Naranja Menta Top Line 4 Un
779401244,Chicle Manzana Menta Top Line 4 Un
779407048,Desodorante en Crema Odorono Rexona 60 Gr
779408106,Conejito de Leche Bon O Bon 50 Gr
779411458,Conejito de Chocolate con Leche Bon O Bon 110 Gr
779411526,Conejito de Chocolate Blanco Bon O Bon 110 Gr
779411694,Conejito de Chocolate Rocklets 100 Gr
779418242,Antitranspirante en Aerosol Original Dove 85 Ml
779418556,Antitranspirante en Aerosol Go Fresh Pepino y Te Verde Dove 85 Ml
779418792,Antitranspirante en Aerosol Invisible Dry Dove 85 Ml
779419096,Desodorante Anti Transpirante Bolilla Sensitive Rexona Men 50 Ml
779419232,Desodorante Anti Transpirante Bolilla Invisible Rexona Men 50 Ml
779419300,Desodorante Anti Transpirante Bolilla V8 Rexona Men 50 Ml
779423338,Antitranspirante Roll On Pepino y Te Verde Go Fresh Dove 50 Ml
779423406,Antitranspirante Roll On Dermo Aclarante Dove Dove 50 Ml
779423710,Chicle Menta Beldent 10 Gr
779423888,Chicle Menta Fuerte Beldent 10 Gr
779423956,Chicle Mentol Beldent 10 Gr
779424014,Chicle Mentol Turbo Beldent 10 Gr
779424182,Chicle Menta Suave Beldent 10 Gr
779429378,Conejito de Chocolate Bon O Bon 50 Gr
779440304,Barra de Cereal Granola con Chocolate Cereal Mix 30 Gr
779442766,Chicle Globo Beldent 10 Gr
779447402,Barra de Cereal Granola Cereal Mix 25 Gr
779454950,Alfajor Yogur y Vainilla Lulemuu 26 Gr
779456008,Chocolate Extra Coco Cofler 32 Gr
779456244,Chocolate Extra Mani Cofler 38 Gr
779466076,Conejito de Chocolate Rocklets 55 Gr
779468056,Caramelos sin Azucar Cherry Menthoplus 1 Un
779468124,Caramelos sin Azucar Durazno Menthoplus 1 Un
779468292,Caramelos sin Azucar Mentol Menthoplus 1 Un
779468360,Caramelos sin Azucar Pomelo Menthoplus 1 Un
779485954,Antitraspirante Invisible Argan y Almendra 5 Plusbelle 50 Ml
779486012,Antitranspirante Invisible Sedosa Plusbelle 50 Ml
779486180,Antitranspirante Invisible Calendula Plusbelle 50 Ml
779486258,Antitranspirante Frescura Duradera Plusbelle 50 Ml
779486326,Antitranspirante Piel Joven Plusbelle 50 Ml
779490354,Chocolate Blanco Aireado Cofler 30 Gr
779490590,Chocolate Blanco y Leche Aireado Cofler 30 Gr
779490804,Chocolate Leche Aireado Cofler 30 Gr
779491108,Desodorante Antibacterial Fresh Rexona 85 Ml
779492334,Cubanito Relleno con Chocolate con Leche Cofler 1 Un
779493492,Cubanito Relleno con Chocolate Semiamargo Cofler 1 Un
779495922,Chicle Uva y Lima Beldent 10 Gr
779500312,Chocolate Cofler Block 110 Gr
779530494,Chocolate Extra Chocolatado Cofler 35 Gr
779530630,Crema Dulce Leche Danette 190 Gr
779530708,Crema Chocolate Danette 190 Gr
779531248,Chocolate Cofler Block 38 Gr
779561184,Chicle Citrus Mix Beldent 10 Gr
779562792,Sal Fina Light Salero Celusal 250 Gr
779563782,Huevo de Chocolate con Leche Rocklets 30 Gr
779564154,Bocadito de Dulce de Leche Mix Semillas Vauquita 40 Gr
779566998,Alfajor Triple Shot 60 Gr
779582288,Cubanitos de Arroz Relleno de Avellana Lulemuu 15 Gr
779585630,Chocolatin Negro Arcor 8 Gr
779585708,Chocolatin Blanco Arcor 8 Gr
779588396,Conejito de Chocolte con Leche Bon O Bon 20 Gr
779614194,Tortuguita Chocolate Arcor 17.5 Gr
779616310,Desodorante Roll-On Plusbelle Care 50 Ml
779616556,Desodorante Roll-On Plusbelle Invisible Care 50 Ml
779618604,Tortuguita Chocolate Blanco Arcor 17.50 Gr
779618840,Cubanitos de Arroz Relleno de Crema de Mani Lulemuu 15 Gr
779629594,Flan Sancorito Vainilla Sancor 110 Gr
779659294,Flan Vainilla + Caramelo Danette 95 Gr
779673818,Caramelos Pera Menthoplus 1 Un
779676406,Postre Dulce de Leche Danette 95 Gr
779676574,Postre Crema Americana Danette 95 Gr
779688522,Gelatina Sabor Frambuesa Serenito 105 Gr
779688690,Gelatina Sabor Frutilla Serenito 105 Gr
779699030,Galletitas con Chips Turimar 150 Gr
779706578,Cubanitos Sabor Limon Arcor 16 Gr
779727368,Caramelos Citrus Menthoplus Powerade 1 Un 24.8 Gr
779727436,Caramelos Mountain Menthoplus Powerade 1 Un 24.8 Gr
779730160,Caramelos Daikiri Menthoplus 1 Un
779730238,Caramelos Mojito Menthoplus 1 Un
779746314,Chocolate de Leche Tofi 28 Gr
779746550,Chocolate Tofi Light 28 Gr
779761096,Tableta de Dulce de Leche Vauquita 25 Gr
779802676,Alfajor Triple Blanco Guaymallen 3 Un 70 Gr
779802744,Alfajor Triple Chocolate Guaymallen 3 Un 70 Gr
779843952,Barra de Cereal Pasion de Chocolate Cereal Mix 26 Gr
779863066,Chocolate Bon O Bon 17 Gr
779901126,Cafe al Coñac Tres Plumas 200 Ml
779917752,Tallarines con Espinaca Don Felipe 500 Gr
779919732,Repelente Crema Family Off! 60 Gr
779933110,Chocolate con Leche y Mani Cannettine 25 Gr
779954078,Barra de Cereal Yogur Light Frutilla Fresas Cereal Mix 28 Gr
779954528,Huevitos Ben 10 22 Gr
779955136,Chocolate Extra Menta Cofler 30 Gr
779956812,Oblea Rellena Rhodesia 22 Gr
786000102,Pastillas Menta Tic Tac 16 Gr
789233552,Desodorante Bolilla Antitranspirante Nutritive Rexona Women 50 Ml
789234238,Desodorante Anti Transpirante Bolilla Sensitive Rexona Men 50 Ml
789234542,Desodorante Bolilla V8 Rexona Men 50 Ml
789243216,Desodorante Bolilla Invisible Rexona Women 50 Ml
789243520,Desodorante Femenino Bolilla Antitranspirante Cotton Rexona 50 Ml
789243834,Desodorante Bolilla Antitranspirante Sin Perfume Rexona Women 50 Ml
789244688,Antitranspirante Roll On Clasico Dove 50 Ml
789245296,Antitranspirante Roll On Invisible Dry Dove 50 Ml
789254724,Desodorante Anti Transpirante Bolilla Invisible Rexona Men 50 Ml
789255196,Antitranspirante Roll On Men Extra Fresh Dove 50 Ml
789265232,Desodorante Femenino Bolilla Active Emotion Rexona 50 Ml
789272544,Antitranspirante Roll On Men Clean Comfor Dove 50 Ml
789285032,Antitranspirante Roll On Dermo Aclarante Dove 50 Ml
789292412,Antitranspirante Roll On Beauty Finish Dove 50 Ml
789293198,Antitranspirante Roll On Men Energy Dry Dove 50 Ml
789315968,Antitranspirante Roll On Pure Dove 50 Ml
789333542,Antitranspirante Roll On Men Invisible Dry Dove 50 Ml
789341394,Desodorante Antibacterial Rexona Men 50 Ml
789341462,Desodorante Femenino Bolilla Antibacterial Rexona 50 Ml
789376976,Antitranspirante Roll On Pera & Aloe Dove 50 Ml
871670166,Cerveza Porron Grolsch 450 Ml
904154182,Energizante Sugar Free Red Bull 250 Ml
1900500102,Chicle Sabor Menta Poosh 1 Un
5030480013,Arroz Parbolizado 00000 Dos Hermanos 1 Kg
5289925440,Gin Original Gordons 700 Ml
7050105105,Toallitas Desmaquillantes para Piel Sensible Neutrogena 25 Un
7920033927,Caramelos Waterm Cherry Nerds 2 Un 94 Gr
7920035723,Caramelos Apple y WaterMelon Nerds 93.4 Gr
8048050544,Ron 8 Años Bacardi 750 Cc
9712244634,Galletas Crackers Zara Ferraris 200 Gr
11210000018,Salsa Picante Original Tabasco 60 Ml
11210000155,Salsa Tabasco Rojo 150 Cc
11210007253,Salsa Tabasco Garlic 60 Ml
11210007352,Salsa Tabasco Garlic 150 Cc
11210007703,Salsa Chipotle en Botella Tabasco 150 Cc
11210009219,Salsa Tabasco Mild 150 Cc
11210009387,Salsa Picante Mild Tabasco 60 Ml
11210009530,Salsa Mild Jalapeño en Frasco Tabasco 60 Cc
11210607033,Salsa Picante Chipotte Tabasco 60 Ml
13000000758,Ketchup Rocket Up Side Down Heinz 397 Gr
13000001151,Ketchup Heinz 397 Gr
13000001243,Ketchup en Pomo Heinz 397 Gr
13000002127,Mostaza Heinz 397 Gr
13000006408,Ketchup en Pomo Heinz 567 Gr
13000007993,Ketchup Reduced Sugar Heinz 397 Gr
13000008976,Ketchup sin Sal Heinz 397 Gr
13000008990,Ketchup Organic Heinz 397 Gr
15700050026,Chocolate en Polvo con Marshmallow Swiss Miss 280 Gr
15700055786,Chocolate en Polvo Marshmallow Lovers Swiss Miss 272 Gr
16000264601,Barra de Cereal Avena Miel Nature Valley 6 Un
16000277076,Barra de Cereal con Mani Caja Nature Valley 210 Gr
16000289208,Barra de Cereal Almendras Tostadas Nature Valley 6 Un
16000407619,Barra de Cereal Chocolate Frutos Secos Nature Valley 6 Un
16000411265,Barra de Cereal Variedad Nature Valley 6 Un
16000413146,Barra de Cereal Avena y Chocolate Nature Valley 6 Un
16000439801,Barra de Cereal con Frutilla y Frutos Seco Nature Valley 6 Un
16000457249,Barra Cereal Protein Caja Nature Valley 201 Gr
18200004735,Cerveza en Lata Budweiser 473 Cc
18200112461,Cerveza Porron Budweiser 355 Ml
19582392236,Salsa Barbacoa Ahumado Botella Bulls Eye 510 Gr
19582411104,Salsa Barbacoa Original Bulls Eye 510 Gr
20800307642,Desodorante en Barra Fresh Old Spice 50 Gr
20800722452,Desodorante en Barra Old Spice After Party 50 Gr
21000026784,Mayonesa con Oliva Kraft 625 Gr
21000052288,Salsa Barbacoa Original Bulls Eye 510 Gr
21000052295,Salsa Barbacoa Hickory Bull s Eye 510 Gr
21000052387,Barbacoa Sweet Kraft 510 Gr
21000500000,Bocado Fino Especial 1 Kg
21001800000,Pata de Carnero Especial 1 Kg
21030200000,Panceta Salada Envasada San Antonio 1 Kg
21055500000,Hamburguesas de Pescado 1 Kg
21066700000,Nuggets Pollo 1 Kg
21200375200,Rodillo Quita Pelusa Scotch Brite 1 Un
21200495991,Rodillo Quitapelusa Scotch Brite Mini 1 Un
21200510014,Guantes de Cocina Tamaño S 1 Un
21200510021,Guantes de Cocina Tamaño M 1 Un
21200510038,Guantes de Cocina Tamaño L 1 Un
21200510045,Guante Multiusos Talle S 2 Un
21200510052,Guantes Multiuso Medianos Scotch Brite 2 Un
21200510069,Guantes Multiusos Tamaño L Scotch 1 Un
21893407851,Bolsa para Residuos 45x60 Cm Green Plast 30 Un
21893407868,Bolsa Consorcio Green Plast 60x90 Cm Green Plast 10 Un
21893407875,Bolsa Consorcio 80x110 Cm Green Plast 10 Un
22000001719,Chicles Sabor Menta Spearmint Wrigleys 5 Un
22000001726,Chicles Sabor Menta Doublemint Wrigleys 5 Un
22000018465,Caramelos Masticables Skittles Original 61 Gr
22000018489,Caramelos Masticables Wild Berry Skittles 61.5 Gr
22000116710,Chicles Spearmint 5 Sticks Wrigleys 45 Gr
22000116727,Chicles Doublemint Wrigleys 45 Gr
22033000000,Vigilante de Manteca 1 Un
22071000000,Medialuna de Manteca 1 Un
22400000305,Shampoo Normal Vo5 444 Ml
22400000565,Shampoo Humectacion Intensiva Vo5 444 Cc
22400000657,Shampoo Cabello Graso Equilibrante Vo5 444 Ml
22400190259,Shampoo Brillo Extremo Vo5 444 Ml
22400194721,Shampoo Fortificado Vo5 440 Ml
22400197029,Acondicionador Brillo Extremo Revitalizante Vo5 444 Ml
22400197036,Acondicionador Suavidad Extra Vo5 440 Ml
22400197531,Acondicionador Humectacion Intensa Vo5 444 Ml
22400198903,Acondicionador para Cabello Graso Vo5 444 Ml
22400198910,Acondicionador Fortificante Vo5 444 Ml
22400210254,Mousse Acondicionador Max Fijacion sin Alcohol Vo5 198 Gr
22400210261,Fijador en Aerosol Extra Body Aerosol Vo5 198 Gr
22400340074,Shampoo Limpieza Profunda Vo5 444 Ml
22400341071,Acondicionador Limpieza Profunda Vo5 444 Ml
22400621814,Spray para Peinar Tresemme Thermal Creations 236 Ml
22400621821,Mousse para Cabello Tresemme Thermal Creations 202 Gr
22400624235,Shampoo Tresemme Thermal Recovery 739 Ml
23008700000,Jamon Cocido Piamontesa 1 Kg
23015700000,Panceta Arrollada Piamontesa 1 Kg
23016000000,Queso de Cerdo Piamontesa 1 Kg
23038400000,Queso Cremoso Pilarcito 1 Kg
23062300000,Queso Cremoso 1 Kg
23069400000,Salame Milan Feteado Champion 1 Kg
23084700000,Aceitunas Negras Vanoli 1 Kg
23092000000,Jamon Cocido Bocatti 1 Kg
24003100000,Calabaza 1 Kg
24014300000,Zanahoria 1 Kg
24018500000,Papa Cepillada 1 Kg
24023900000,Perejil 1 Un
24085900000,Pimiento Amarillo 1 Kg
24223000319,Ron Santa Teresa 700 Cc
24223300150,Ron Selecto 10 Años Santa Teresa 700 Cc
25700712008,Bolsa para Llevar Chica Ziploc 14 Un
26964177190,Ron Oro Flor de Caña 750 Cc
26964823967,Ron Centenario 12 Años Flor de Caña 750 Cc
26964852745,Ron Añejo 7 Años Flor de Caña 750 Cc
26964904291,Ron Blanco Flor de Caña 750 Cc
27000382462,Ketchup Hunts 380 Gr
27000382493,Ketchup Botella Hunts 680 Gr
27000500019,Salsa de Tomate Zesty Spicy Hunts 680 Gr
27000500040,Salsa de Vegetales Chunky Hunts 680 Gr
27000500064,Salsa de Tomate Tradicional Hunt 680 Gr
27000500071,Salsa de Tomate con Hongos Hunts 680 Gr
27000500101,Salsa Cuatro Quesos Hunts 680 Gr
27000500118,Salsa de Tomate con Hierbas Hunts 680 Gr
27000609019,Salsa Barbacoa Original Hunts 510 Gr
27000609040,Salsa Barbacoa Ahumada Hunts 510 Gr
27000609057,Salsa Barbacoa con Miel Hunts 510 Gr
27000609064,Salsa Barbacoa con Miel y Mostaza Hunts 510 Gr
29000012585,Peanuts Salted Planters 170 Gr
29000072732,Mantequilla de Mani Kraft 340 Gr
30521011933,Toallitas Desmaquillantes para Piel Seca Pond's 30 Un
34000000074,Pastillas Ice Breakers Cool Mint Hersheys 42 Gr
34000009954,Pastillas Ice Breakers Mix Berry Hersheys 42 Gr
35000689610,Cepillo Dental Colgate Max White 4 Un
36000167900,Toallitas Humedas One & Done Huggies 64 Un
36000180855,Pañal XXG Good Nites 9 Un
36000393507,Trajes de Baño Bebe Pequeño Huggies Little Swimmers 12 Un
36000393521,Trajes de Baño Bebe Mediano Huggies Little Swimmers 11 Un
36000393538,Trajes de Baño Bebe Grande Huggies Little Swimmers 10 Un
36000456097,Pañal M Unisex Goodnites 4 Un
36000456103,Pañal G Unisex Goodnites 4 Un
37000006619,Esponja Mr Clean 1 Un
37000018704,Quitamanchas Instantaneo Tide To Go 1 Un
37000096146,Antitraspirante Powder Clinical Secreet 45 Gr
37000096153,Desodorante en Crema Clinical Lightyfresh Secret 45 Gr
37000138754,Detergente Liquido Original 16 Lavadas Tide 1 Un
37000185086,Papas Fritas Original Pringles 37 Gr
37000185192,Papas Fritas Queso Cheddar Pringles 71 Gr
37000208266,Detergente Liquido Dreft 1.47 Lt
37000355106,Suavizante para Ropa April Fresh Downy 189 Cc
37000401520,Lavavajilla Cascade 2.12 Kg
37000425489,Suavizante para Ropa April Fres Downy 295 Cc
37000505853,Pañal 6 Splashers Pampers 21 Un
37000808046,Desodorante en Barra 48 Hs Protecting Power Secret 73 Gr
37000808190,Desodorante Femenino en Gel Protec Secret 73 Gr
37000808220,Desodorante Femenino en Gel Clean Secret 73 Gr
37000823049,Aromatizante para Ropa Unstopables Fresh Downy 275 Gr
37000834656,Suavizante Concentrado para Ropa Downy 1 Un
37000874720,Jabon Liquido Ropa Plus Concentrado Tide 1.36 Lt
37000875154,Jabon Liquido En Botella Tide Sport 1.36 Lt
37000964414,Jabon Liquido Capsula 3 en 1 Pods Ariel 16 Un
37000977070,Tabletas para Lavavajillas Limon Cascade 11 Un
38000184963,Papas Fritas Original Pringles 124 Gr
38000184970,Papas Fritas Crema y Cebolla Pringles 137 Gr
38000185014,Papas Fritas Queso Pringles 137 Gr
38000185069,Papas Fritas Barbacoa Pringles 160 Gr
38000185083,Papas Fritas Pizza Pringles 124 Gr
38000185199,Papas Fritas Sabor Jamon Pringles 124 Gr
38000187384,Papas Frita Queso Futbol Pringles 149 Gr
38000187391,Papas Fritas Crema y Cebolla Futbol Pringles 149 Gr
38000187407,Papas Frita Original Futbol Pringles 149 Gr
38000845246,Papas Fritas Sabor Original Pringles 67 Gr
38000845253,Papas Fritas Crema y Cebolla Pringles 71 Gr
38000845260,Papas Fritas Queso Pringles 71 Gr
38000846731,Papas Fritas Original Pringles 37 Gr
38000846748,Papas Fritas Cebolla Pringles 40 Gr
38000846755,Papas Fritas Queso Pringles 40 Gr
39047011496,Galletitas Sabor Chocolate con Chips Walkers 125 Gr
39153300101,Colavita Grilled Artichokes 120 Gr
39153413559,Balsamico Glace Colavita 250 Ml
40000000518,Caramelos Masticables Starb 58.7 Gr
40000001607,Caramelos Original Skittles 61.5 Gr
40000001621,Caramelos Acidos Confitados Skittles 61.5 Gr
40000001638,Caramelos Confitados Tropical Skittles 61.5 Gr
40000017318,Confites de Chocolate M&M 150 Gr
40000017325,Mani con Chocolate M&M 150 Gr
40232846359,Agua Mineral Alvura 500 Cc
40232846373,Agua Mineral sin Gas Alvura 1.5 Lt
40232846397,Agua Mineral sin Gas Alvura 2.25 Lt
40232920318,Agua Mineral sin Gas Alvura 6 Lt
40232934605,Jugo de Arandano y Zarzamora sin Azucar 1.25 Lt
40232934933,Mermelada de Multifruta Starberry 450 Gr
41390000010,Salsa de Soja Kikkoman 148 Cc
41500750903,Mostaza Clasica Frenchs 226 Gr
41500767376,Salsa Inglesa Botella Frenchs 147 Gr
41500888156,Salsa Picante Frenchs 148 Ml
41554198522,Lapiz Labial Sensasional 635 Maybelline 1 Un
41554220186,Delineador de Ojo Maybelline Studio Last 3 Gr
41554238723,Base de Maquillaje Liquida Fit Me Buff Maybelline 30 Ml
41554247732,Corrector de Ojeras Maybelline 6.8 Ml
41554259247,Corrector de Ojeras Maybelline 1 Un
41554259261,Corrector de Ojeras Maybelline 1 Un
41554408850,Sombra Maybelline Ojos 1 Un
41554429886,Lapiz Labial Creamy Matte Maybelline 1 Un
41554429916,Lapiz Labial Ravishing Rose Maybelline 1 Un
41554429923,Lapiz Labial Maybelline Creamy Matte 1 Un
41554429954,Lapiz Labial Maybelline Creamy Matte 1 Un
41554429961,Lapiz Labial Maybelline Creamy Matte 1 Un
41554443493,Mascara para Pestañas Maybelline Falsies 2 Gr
41570006726,Almendras con Ahumadas Blue Diamond 150 Gr
41570035191,Almendras Tostadas Saladas Blue Diamond 150 Gr
41570071731,Almendras Tostadas Saladas con Miel Blue Diamond 150 Gr
